[
  {
    "entity_id": "asset-microsoft-newport-wales",
    "name": "Microsoft Data Centre — Newport / Imperial Park, Wales",
    "layer": 3,
    "entity_type": "data_centre",
    "parent_group": "Microsoft",
    "hq_country": "GB",
    "exposure_inputs": {
      "book_concentration": {
        "rating_0_4": 3,
        "rationale": "Two hyperscale buildings on a single 40-acre Imperial Park campus at the former Quinn Radiators site rather than a multi-site spread.",
        "sources": [
          "https://www.datacenterdynamics.com/en/analysis/silicon-valleys-how-wales-became-a-data-center-hub/",
          "https://news.microsoft.com/source/emea/features/building-the-future-how-datacenters-are-innovating-with-sustainability-in-mind/"
        ],
        "confidence": "medium"
      },
      "non_firm_intensity": {
        "rating_0_4": 3,
        "rationale": "Campus is under construction with phase-one go-live expected late 2026; SSE is still reinforcing the high-voltage feed, so firm grid capacity is not yet evidenced as operational.",
        "sources": [
          "https://www.southwalesargus.co.uk/news/25715201.sse-plan-enhance-power-major-newport-data-centre/",
          "https://www.datacenterdynamics.com/en/analysis/silicon-valleys-how-wales-became-a-data-center-hub/"
        ],
        "confidence": "medium"
      },
      "aggregation_correlation": {
        "rating_0_4": 2,
        "rationale": "Part of a fast-growing South Wales M4 corridor cluster alongside Vantage CWL1 and other Imperial Park developments, sharing regional grid infrastructure.",
        "sources": [
          "https://www.datacenterdynamics.com/en/analysis/silicon-valleys-how-wales-became-a-data-center-hub/",
          "https://www.gov.uk/government/news/ai-to-power-national-renewal-as-government-announces-billions-of-additional-investment-and-new-plans-to-boost-uk-businesses-jobs-and-innovation"
        ],
        "confidence": "medium"
      },
      "trigger_gap": {
        "rating_0_4": 3,
        "rationale": "No disclosed availability or parametric curtailment cover; assumed damage-only property cover for a pre-operational hyperscale build.",
        "sources": [
          "https://www.gov.uk/government/news/boost-for-uk-ai-as-microsoft-unveils-25-billion-investment"
        ],
        "confidence": "low"
      },
      "tenor_mismatch": {
        "rating_0_4": 3,
        "rationale": "£2.5bn multi-year UK AI investment horizon against a campus still under construction with limited operating curtailment history.",
        "sources": [
          "https://www.gov.uk/government/news/boost-for-uk-ai-as-microsoft-unveils-25-billion-investment",
          "https://www.datacenterdynamics.com/en/analysis/silicon-valleys-how-wales-became-a-data-center-hub/"
        ],
        "confidence": "medium"
      }
    },
    "preparedness_inputs": {
      "data_monitoring": {
        "rating_0_4": 3,
        "rationale": "Hyperscaler with global fleet telemetry and on-site circular-centre operations for UK hardware lifecycle management.",
        "sources": [
          "https://news.microsoft.com/source/emea/features/building-the-future-how-datacenters-are-innovating-with-sustainability-in-mind/"
        ],
        "confidence": "medium"
      },
      "product_fit": {
        "rating_0_4": 1,
        "rationale": "No disclosed availability or parametric curtailment insurance product for the Newport build.",
        "sources": [
          "https://www.gov.uk/government/news/boost-for-uk-ai-as-microsoft-unveils-25-billion-investment"
        ],
        "confidence": "low"
      },
      "underwriting_expertise": {
        "rating_0_4": 1,
        "rationale": "Asset-level entity without dedicated insurance underwriting function.",
        "sources": [
          "https://www.gov.uk/government/news/boost-for-uk-ai-as-microsoft-unveils-25-billion-investment"
        ],
        "confidence": "low"
      },
      "capital_reinsurance": {
        "rating_0_4": 4,
        "rationale": "Backed by Microsoft's balance sheet as part of its largest-ever UK investment programme.",
        "sources": [
          "https://www.gov.uk/government/news/boost-for-uk-ai-as-microsoft-unveils-25-billion-investment"
        ],
        "confidence": "high"
      },
      "pricing_modelling": {
        "rating_0_4": 1,
        "rationale": "Physical asset, not a risk-pricing or underwriting entity.",
        "sources": [
          "https://www.gov.uk/government/news/boost-for-uk-ai-as-microsoft-unveils-25-billion-investment"
        ],
        "confidence": "low"
      }
    },
    "asset_link": {
      "covered_assets": [],
      "gate_status": "unknown",
      "curtailment_exposure": "medium",
      "backup_generation": null
    },
    "provenance": {
      "researched_by": "asset_researcher",
      "last_checked": "2026-06-27",
      "method": "llm_research"
    },
    "notes": "Imperial Park brownfield campus; planning approved 2024; South Wales AI Growth Zone; SSE 1.94 km HV cable reinforcement in progress; part of £2.5bn UK AI DC programme."
  },
  {
    "entity_id": "asset-oracle-cloud-region-uk",
    "name": "Oracle Cloud — UK Sovereign Region (London & Newport)",
    "layer": 3,
    "entity_type": "data_centre",
    "parent_group": "Oracle",
    "hq_country": "GB",
    "exposure_inputs": {
      "book_concentration": {
        "rating_0_4": 2,
        "rationale": "Dual-region sovereign cloud split across geographically separate London and Newport facilities rather than one campus.",
        "sources": [
          "https://www.oracle.com/cloud/uk-sovereign-cloud/",
          "https://www.oracle.com/uk/government/govcloud/"
        ],
        "confidence": "high"
      },
      "non_firm_intensity": {
        "rating_0_4": 0,
        "rationale": "Both regions have been operational since 2019–2020 with N2 redundant power and generator backups documented for OCI facilities.",
        "sources": [
          "https://www.oracle.com/cloud/uk-sovereign-cloud/faq/",
          "https://docs.oracle.com/en-us/iaas/Content/Security/Concepts/security_overview.htm"
        ],
        "confidence": "medium"
      },
      "aggregation_correlation": {
        "rating_0_4": 2,
        "rationale": "Two UK regions interconnected by private backbone but both sit on domestic grid boundaries, giving partial geographic diversification only.",
        "sources": [
          "https://www.oracle.com/cloud/uk-sovereign-cloud/",
          "https://www.oracle.com/uk/government/govcloud/"
        ],
        "confidence": "medium"
      },
      "trigger_gap": {
        "rating_0_4": 3,
        "rationale": "No disclosed availability or parametric curtailment insurance; sovereign SLA focus is on uptime rather than grid-firmness cover.",
        "sources": [
          "https://www.oracle.com/cloud/uk-sovereign-cloud/faq/"
        ],
        "confidence": "low"
      },
      "tenor_mismatch": {
        "rating_0_4": 2,
        "rationale": "Regions operating since 2019–2020 with long-term government workloads, but limited public curtailment-loss history.",
        "sources": [
          "https://www.oracle.com/cloud/uk-sovereign-cloud/faq/",
          "https://www.oracle.com/uk/government/govcloud/"
        ],
        "confidence": "medium"
      }
    },
    "preparedness_inputs": {
      "data_monitoring": {
        "rating_0_4": 3,
        "rationale": "Hyperscale OCI platform with UK-based control, monitoring and logging systems under sovereign operations model.",
        "sources": [
          "https://www.oracle.com/cloud/uk-sovereign-cloud/faq/"
        ],
        "confidence": "medium"
      },
      "product_fit": {
        "rating_0_4": 1,
        "rationale": "Engineering redundancy (UPS, generators) documented but no grid-availability insurance product disclosed.",
        "sources": [
          "https://docs.oracle.com/en-us/iaas/Content/Security/Concepts/security_overview.htm"
        ],
        "confidence": "low"
      },
      "underwriting_expertise": {
        "rating_0_4": 1,
        "rationale": "Cloud region asset without dedicated insurance underwriting capability.",
        "sources": [
          "https://www.oracle.com/cloud/uk-sovereign-cloud/"
        ],
        "confidence": "low"
      },
      "capital_reinsurance": {
        "rating_0_4": 4,
        "rationale": "Oracle-backed sovereign infrastructure serving UK government and defence workloads with PASF-accredited facilities.",
        "sources": [
          "https://www.oracle.com/uk/government/govcloud/"
        ],
        "confidence": "high"
      },
      "pricing_modelling": {
        "rating_0_4": 1,
        "rationale": "Infrastructure asset, not a risk-pricing entity.",
        "sources": [
          "https://www.oracle.com/cloud/uk-sovereign-cloud/"
        ],
        "confidence": "low"
      }
    },
    "asset_link": {
      "covered_assets": [],
      "gate_status": "unknown",
      "curtailment_exposure": "low",
      "backup_generation": true
    },
    "provenance": {
      "researched_by": "asset_researcher",
      "last_checked": "2026-06-27",
      "method": "llm_research"
    },
    "notes": "Dual-region UK Sovereign Cloud: London (Dec 2019) and Newport (Jul 2020); PASF-accredited; physically isolated rooms within UK colocation sites; inter-region private backbone."
  },
  {
    "entity_id": "asset-pure-dc-croydon",
    "name": "Pure Data Centres — Park Royal, West London",
    "layer": 3,
    "entity_type": "data_centre",
    "parent_group": "Pure Data Centres Group / SEGRO",
    "hq_country": "GB",
    "exposure_inputs": {
      "book_concentration": {
        "rating_0_4": 3,
        "rationale": "Single 10-acre Park Royal campus (LON02) delivering up to 56–72 MW IT load in one West London availability-zone location.",
        "sources": [
          "https://puredc.com/our-london-park-royal-site",
          "https://www.londonbuildexpo.com/news/pure-data-centres"
        ],